{
    "$schema": "../../schemas/feature.schema.json",
    "id": "002-feature-spa_front",
    "slug": "spa_front",
    "description": {
        "es": "Ubicación privilegiada frente a balnearios termales o spas naturales, con acceso directo a las instalaciones de relajación",
        "en": "Ubicación privilegiada frente a balnearios termales o spas naturales, con acceso directo a las instalaciones de relajación",
        "pt": "Ubicación privilegiada frente a balnearios termales o spas naturales, con acceso directo a las instalaciones de relajación"
    },
    "applicableVerticals": ["accommodation"],
    "icon": "SpaFrontIcon",
    "isBuiltin": true,
    "isFeatured": false,
    "displayWeight": 85,
    "lifecycleState": "ACTIVE"
}
