{
    "$schema": "../../schemas/feature.schema.json",
    "id": "085-feature-family_friendly",
    "slug": "family_friendly",
    "description": {
        "es": "Ambiente acogedor y seguro para familias con niños de todas las edades",
        "en": "Ambiente acogedor y seguro para familias con niños de todas las edades",
        "pt": "Ambiente acogedor y seguro para familias con niños de todas las edades"
    },
    "applicableVerticals": ["venue"],
    "icon": "FamilySuitableIcon",
    "isBuiltin": false,
    "isFeatured": true,
    "displayWeight": 65,
    "lifecycleState": "ACTIVE"
}
