{
    "$schema": "../../schemas/feature.schema.json",
    "id": "039-feature-perimeter_fence",
    "slug": "perimeter_fence",
    "description": {
        "es": "Cercado completo de la propiedad que garantiza privacidad, seguridad y delimitación clara del espacio",
        "en": "Cercado completo de la propiedad que garantiza privacidad, seguridad y delimitación clara del espacio",
        "pt": "Cercado completo de la propiedad que garantiza privacidad, seguridad y delimitación clara del espacio"
    },
    "applicableVerticals": ["accommodation"],
    "icon": "PerimeterFenceIcon",
    "isBuiltin": true,
    "isFeatured": false,
    "displayWeight": 45,
    "lifecycleState": "ACTIVE"
}
